{
  "schema_version": "capability-registry-v1",
  "plugin": {
    "name": "analytix-fund-analysis",
    "version": "0.16.16",
    "distribution": "analytix-hub",
    "runtime_boundary": "Analytix-owned runtime only; no system Codex hooks, config, cache, or plugin state."
  },
  "focused_skills": [
    {
      "id": "index",
      "use_when": [
        "broad plugin entry",
        "bare /analytix",
        "capability orientation"
      ],
      "not_for": [
        "full-case analysis",
        "report writing",
        "object dossier once task is clear"
      ],
      "commands": [
        "/analytix",
        "/analytix ask"
      ],
      "completion_standard": "current case/status, available lanes, and next focused skill suggestions; no full-case/report gate"
    },
    {
      "id": "case-context",
      "use_when": [
        "current case",
        "scope map",
        "coverage",
        "account-opening coverage",
        "contact/address coverage",
        "task feedback coverage",
        "coercive-measure coverage",
        "casegraph context",
        "transaction-environment coverage",
        "IP/MAC coverage",
        "merchant/channel coverage"
      ],
      "not_for": [
        "object dossier",
        "report writing",
        "claim review"
      ],
      "commands": [
        "/analytix scope",
        "/analytix map",
        "/analytix casegraph"
      ],
      "completion_standard": "Case Scope Card with coverage, quality boundaries, and next focused skill choices"
    },
    {
      "id": "data-quality",
      "use_when": [
        "import cleaning coverage",
        "account-opening coverage",
        "contact/address coverage",
        "task feedback coverage",
        "coercive-measure coverage",
        "same-fact duplicate",
        "card replacement",
        "missing holder/counterparty",
        "amount source/scope support",
        "transaction-environment coverage",
        "IP/MAC coverage",
        "merchant/channel coverage",
        "missing environment fields"
      ],
      "not_for": [
        "report generation",
        "broad object dossier"
      ],
      "commands": [
        "/analytix audit",
        "/analytix duplicates",
        "/analytix compare-scopes",
        "/analytix qa"
      ],
      "completion_standard": "复核意见应列明已有数据支持的事实、待核线索风险、当前证据不足的统计项和补充核验方向"
    },
    {
      "id": "quick-fact",
      "use_when": [
        "single fact",
        "Top ranking",
        "biggest account holder counterparty",
        "bounded low-risk amount/count"
      ],
      "not_for": [
        "object dossier",
        "full-case analysis",
        "formal report",
        "Pair Amount or amount challenge"
      ],
      "commands": [
        "/analytix rank",
        "/analytix ask"
      ],
      "completion_standard": "一轮内给出低风险事实快查结论，写明指标、方向、范围、覆盖情况、金额/笔数和证据边界；特定双方资金往来核验和金额争议必须转交 pair-amount-investigation。"
    },
    {
      "id": "pair-amount-investigation",
      "use_when": [
        "Pair Amount",
        "A transferred how much to B",
        "amount challenge",
        "duplicate/card-replacement amount dispute",
        "same-fact amount reconciliation",
        "raw vs effective/dedup amount basis"
      ],
      "not_for": [
        "ordinary Top ranking",
        "object dossier",
        "full-case analysis",
        "formal report writing"
      ],
      "commands": [
        "/analytix amount",
        "/analytix ask"
      ],
      "completion_standard": "特定双方资金往来核验研判 with conclusion, period, raw/effective/dedup amount and count, large-transaction table, duplicate/key safety, account/time concentration, difference explanation, abnormal features, relationship/purpose leads, unsupported limits, and downstream/evidence requests."
    },
    {
      "id": "account-dossier",
      "use_when": [
        "card fund analysis",
        "account profile",
        "account-opening facts",
        "linked contact/address clues",
        "account role classification",
        "account anomaly features",
        "transaction-environment clues",
        "IP/MAC/channel clues",
        "merchant/platform clues"
      ],
      "not_for": [
        "simple ranking",
        "full-case analysis"
      ],
      "commands": [
        "/analytix account <account>",
        "/analytix destination"
      ],
      "completion_standard": "账户资金画像 with opening/registry facts, linked contact/address clues, transaction-environment/IP/MAC/channel clues, scope, time span, inflow/outflow, Top counterparties, account role leads, behavior, anomalies, source/destination, evidence gaps, and investigation next steps"
    },
    {
      "id": "subject-dossier",
      "use_when": [
        "person fund analysis",
        "company fund analysis",
        "holder profile",
        "one-person-one-file",
        "account leads needing proof",
        "per-account roles",
        "contact/address correlation",
        "device/IP/MAC/channel correlation",
        "group-association lead"
      ],
      "not_for": [
        "single-account dossier",
        "formal report writing"
      ],
      "commands": [
        "/analytix holder <name>",
        "/analytix owner <name>"
      ],
      "completion_standard": "主体资金画像 with identity/opening facts, contact/address/employer and device/IP/MAC/channel correlation, registered accounts, account leads needing proof, per-account roles, account structure, inflow/outflow, Top accounts/counterparties, source/destination, group-association leads, anomalies, evidence gaps, and investigation next steps"
    },
    {
      "id": "counterparty-analysis",
      "use_when": [
        "counterparty ranking",
        "common counterparties",
        "associated fund channel",
        "missing counterparty",
        "subpoena priority",
        "payment/merchant/platform channel",
        "virtual-asset-like counterparty",
        "shared channel lead"
      ],
      "not_for": [
        "full path tracing",
        "report generation"
      ],
      "commands": [
        "/analytix destination",
        "/analytix outflows",
        "/analytix payment"
      ],
      "completion_standard": "counterparty priorities, evidence status, account/missing-boundary separation, payment/merchant/platform leads, and subpoena targets"
    },
    {
      "id": "fund-tracing",
      "use_when": [
        "source tracing",
        "destination tracing",
        "continue one more hop",
        "next hop",
        "return flow",
        "cash bridge candidate",
        "asset/financial/payment/cross-border endpoint",
        "merchant/platform endpoint",
        "virtual-asset endpoint",
        "payment-channel endpoint"
      ],
      "not_for": [
        "simple Top ranking",
        "unsupported narrative arrows"
      ],
      "commands": [
        "/analytix path <seed>",
        "/analytix outflows"
      ],
      "completion_standard": "列明可证实交易边、待核停顿点、现金/资产/理财/支付/商户/平台/虚拟资产/跨境端点边界、余额承接缺口和补调核验动作"
    },
    {
      "id": "investigation-lab",
      "use_when": [
        "open-ended hypothesis",
        "suspicious pattern",
        "account role classification",
        "identity/contact/address correlation",
        "living-card normality",
        "transit/convergence account",
        "cash break",
        "financial product lead",
        "asset/project/litigation/cross-border lead",
        "public-to-private two-layer statistics",
        "cost normality review",
        "negative search",
        "device/IP/MAC correlation",
        "group-association lead",
        "payment/merchant/platform lead",
        "virtual-asset lead",
        "tax/contract lead"
      ],
      "not_for": [
        "simple Top fact",
        "formal report writing"
      ],
      "commands": [
        "/analytix lab",
        "/analytix discovery",
        "/analytix probe",
        "/analytix pattern",
        "/analytix cash",
        "/analytix financial",
        "/analytix topic",
        "/analytix cash-bridge",
        "/analytix crypto",
        "/analytix role",
        "/analytix asset",
        "/analytix control",
        "/analytix device",
        "/analytix group",
        "/analytix platform",
        "/analytix tax"
      ],
      "completion_standard": "hypothesis queue with evidence status, account role candidates, contact/address/device/IP/MAC leads, group-association leads, payment/merchant/platform/virtual-asset leads, total-vs-classified splits, cost-normality findings, normality downgrades, verified facts, forbidden-as-fact items, and next actions"
    },
    {
      "id": "full-case-analysis",
      "use_when": [
        "full-case analysis",
        "全案分析",
        "完整研判",
        "complete investigation",
        "run analysis tree",
        "run full analysis tree",
        "systematic case review",
        "transaction-environment coverage",
        "group-association leads",
        "platform/virtual-asset leads",
        "tax/contract leads"
      ],
      "not_for": [
        "report writing unless explicitly requested"
      ],
      "commands": [
        "/analytix plan"
      ],
      "completion_standard": "Full-case fact tree with data scale, cleaned/index/report coverage, account/contact/address/transaction-environment/task feedback/coercive coverage, subject/account/counterparty rankings, group-association leads, account roles, cash/asset/financial/payment/merchant/platform/virtual-asset/cross-border/tax-contract leads, two-layer public-to-private stats, cost normality, supported flows, gaps, and continuation queue"
    },
    {
      "id": "report-builder",
      "use_when": [
        "generate report",
        "formal material",
        "report draft",
        "attachment materialization"
      ],
      "not_for": [
        "ordinary full-case analysis",
        "quick fact"
      ],
      "commands": [
        "/analytix report"
      ],